{"$schema":"https://json-schema.org/draft/2020-12/schema","title":"Knowledge Record v1","type":"object","additionalProperties":false,"required":["record_id","record_type","content","status","provenance","created_utc"],"properties":{"record_id":{"type":"string"},"record_type":{"enum":["QUESTION","FINDING","CHALLENGE","KNOWLEDGE"]},"content":{},"status":{},"provenance":{"type":"object"},"created_utc":{"type":"string"},"supersedes":{"type":["string","null"]},"superseded_by":{"type":["string","null"]},"rejection_reason":{"enum":["METHOD_FAILURE","CONFIRMATION_FAILURE",null]}}}
