{
  "record_type": "QUESTION",
  "record_id": "Q-EXAMPLE-001",
  "content": {
    "question": "Example only; replace with an explicitly promoted research question."
  },
  "status": "OPEN",
  "provenance": {
    "evidence_ids": [],
    "researcher_id": "A-01"
  },
  "created_utc": "2026-01-01T00:00:00Z"
}
